{"dimensions":{"source support":"pass","fairness":"fail","natural task contract":"uncertain","structural witness isolation":"uncertain","semantic novelty":"uncertain","cheap-probe falsifiability":"uncertain"},"verdict":"kill","rationale":"The primary-source incident supports the claimed resource-complexity blind spot. Fairness fails because the packet says semantics, request grammar, resource budget, and deterministic work counter must be public, but it supplies none of their concrete definitions or thresholds. Therefore hidden cases could depend on an undocumented semantic or measurement contract.","earliestFailedDimension":"fairness"}
